<?xml version="1.0" encoding="UTF-8"?>
<!DOCTYPE Resultadospartidos SYSTEM "BBVA.dtd">
<Resultadospartidos>
    <Equipos>
        <Equipo>
            AMERICA
            <Goles>
                <GF>38</GF>
                <GC>17</GC>
            </Goles>
            <Partidos>
                <PJ>17</PJ>
                <PG>12</PG>
                <PP>3</PP>
                <PE>2</PE>
            </Partidos>
            <DIF>+21</DIF>
            <PTS>38</PTS>
        </Equipo>
        <Equipo>
            Santos
            <Partidos>
                <PJ>17</PJ>
                <PG>10</PG>
                <PP>4</PP>
                <PE>3</PE>
            </Partidos>
            <Goles>
                <GF>38</GF>
                <GC>21</GC>
            </Goles>
            <DIF>+17</DIF>
            <PTS>33</PTS>
        </Equipo>
    </Equipos>
</Resultadospartidos>